{
  "$schema": "http://json-schema.org/draft-07/schema#",
  "title": "ValidationReport",
  "type": "object",
  "required": ["status", "issues", "severity"],
  "properties": {
    "schema_version": { "type": "string", "enum": ["1.1"] },
    "status": { "type": "string", "enum": ["pass", "fail"] },
    "severity": { "type": "string", "enum": ["pass", "warning", "error"] },
    "source_path": { "type": "string" },
    "issues": {
      "type": "array",
      "items": {
        "type": "object",
        "required": ["message", "severity", "affected_section"],
        "properties": {
          "schema_version": { "type": "string", "enum": ["1.0"] },
          "message": { "type": "string" },
          "severity": { "type": "string", "enum": ["error", "warning", "info"] },
          "affected_section": { "type": "string" },
          "rule_id": { "type": "string" },
          "violation_type": { "type": "string" },
          "repair_target": { "type": "string" },
          "entity_id": { "type": "string" },
          "evidence_ids": {
            "type": "array",
            "items": { "type": "string" }
          }
        }
      }
    }
  }
}
