{
  "schema_version": "1.1",
  "status": "fail",
  "severity": "error",
  "source_path": "C:\\Programing\\Market lense\\out\\1764f08de574a6ee1312e8e9eea329d4255e8a0f-pdf\\report_analysis\\validation_regen_candidate_2.json",
  "issues": [
    {
      "schema_version": "1.0",
      "message": "[grounding] [grounding|missing_material_evidence] Candidate lost the original material evidence reference.",
      "severity": "error",
      "affected_section": "insights_candidates:super-user-early-adoption-comparison",
      "rule_id": "grounding",
      "repair_target": "insights_bundle",
      "entity_id": "super-user-early-adoption-comparison",
      "evidence_ids": []
    },
    {
      "schema_version": "1.0",
      "message": "[grounding] [grounding|missing_material_evidence] Candidate lost the original material evidence reference.",
      "severity": "error",
      "affected_section": "insights_final:super-user-early-adoption-comparison",
      "rule_id": "grounding",
      "repair_target": "insights_bundle",
      "entity_id": "super-user-early-adoption-comparison",
      "evidence_ids": []
    },
    {
      "schema_version": "1.0",
      "message": "[metrics] Metric timeframe '2021; prior 12 months' not present in evidence for gamers-non-gaming-activity-in-games",
      "severity": "warning",
      "affected_section": "insights:gamers-non-gaming-activity-in-games",
      "rule_id": "metrics",
      "repair_target": "",
      "entity_id": "",
      "evidence_ids": []
    },
    {
      "schema_version": "1.0",
      "message": "LLM grounding validation is deferred and must run before final publish.",
      "severity": "info",
      "affected_section": "validation",
      "rule_id": "deferred_grounding_required",
      "repair_target": "validation_grounding",
      "entity_id": "1ictWKc_jIIy1NozvCorBSPINo4W0DFMB",
      "evidence_ids": []
    },
    {
      "schema_version": "1.0",
      "message": "[regeneration_scope_violation] Targeted repair changed an undeclared artifact path",
      "severity": "error",
      "affected_section": "insights_candidates[item=super-user-early-adoption-comparison]",
      "rule_id": "regeneration_scope_violation",
      "repair_target": "",
      "entity_id": "",
      "evidence_ids": []
    },
    {
      "schema_version": "1.0",
      "message": "[regeneration_scope_violation] Targeted repair changed an undeclared artifact path",
      "severity": "error",
      "affected_section": "insights_final[item=super-user-early-adoption-comparison]",
      "rule_id": "regeneration_scope_violation",
      "repair_target": "",
      "entity_id": "",
      "evidence_ids": []
    }
  ]
}